{
  "schema": "h3-clip-plan/v1",
  "job_id": "fish_glass_silent_en",
  "variant_id": "v001",
  "max_reference_images": 3,
  "require_scene_lock": true,
  "total_edit_duration_seconds": 26.533,
  "clips": [
    {
      "id": "H01",
      "scene_id": "sunlit-window-dark-wood-tray",
      "duration_seconds": 2,
      "trim_duration_seconds": 1.467,
      "keyframe_ids": ["1"],
      "product_reference": "codex_clone_refs/fish_glass/pic_1.jpg",
      "cues": [{"keyframe_id": "1", "picture": 1, "scene_id": "sunlit-window-dark-wood-tray", "start_seconds": 0.0, "end_seconds": 1.467, "transition": "start", "action": "Begin on the two finished drinks and snap from slightly soft focus to crisp focus while both glasses remain still."}]
    },
    {
      "id": "H02",
      "scene_id": "warm-living-room-light-wood-table",
      "duration_seconds": 2,
      "trim_duration_seconds": 1.5,
      "keyframe_ids": ["2"],
      "product_reference": "codex_clone_refs/fish_glass/pic_1.jpg",
      "cues": [{"keyframe_id": "2", "picture": 1, "scene_id": "warm-living-room-light-wood-table", "start_seconds": 0.0, "end_seconds": 1.5, "transition": "start", "action": "Tilt the empty glass diagonally and make one controlled quarter-turn so the double wall, fish motif, rim and thick base read clearly."}]
    },
    {
      "id": "H03",
      "scene_id": "warm-kitchen-dark-wood-tray",
      "duration_seconds": 6,
      "trim_duration_seconds": 5.066,
      "keyframe_ids": ["3"],
      "product_reference": "codex_clone_refs/fish_glass/pic_1.jpg",
      "cues": [{"keyframe_id": "3", "picture": 1, "scene_id": "warm-kitchen-dark-wood-tray", "start_seconds": 0.0, "end_seconds": 5.066, "transition": "start", "action": "Use slim tongs to place three large clear ice cubes into the upright glass one by one, then place one small lemon slice against the inner wall."}]
    },
    {
      "id": "H04",
      "scene_id": "warm-kitchen-white-marble",
      "duration_seconds": 3,
      "trim_duration_seconds": 2.034,
      "keyframe_ids": ["4"],
      "product_reference": "codex_clone_refs/fish_glass/pic_1.jpg",
      "cues": [{"keyframe_id": "4", "picture": 1, "scene_id": "warm-kitchen-white-marble", "start_seconds": 0.0, "end_seconds": 2.034, "transition": "start", "action": "The full-size 1.5-litre glass pitcher pours one steady sparkling-water stream over the ice; keep the target glass upright and centred on the white marble surface."}]
    },
    {
      "id": "H05",
      "scene_id": "warm-macro-dark-wood-table",
      "duration_seconds": 2,
      "trim_duration_seconds": 1.4,
      "keyframe_ids": ["5"],
      "product_reference": "codex_clone_refs/fish_glass/pic_1.jpg",
      "cues": [{"keyframe_id": "5", "picture": 1, "scene_id": "warm-macro-dark-wood-table", "start_seconds": 0.0, "end_seconds": 1.4, "transition": "start", "action": "Hold the extreme close-up on the dark wooden table; fine bubbles climb around the ice and lemon while the complete rim, fish pattern and thick base stay readable."}]
    },
    {
      "id": "H06",
      "scene_id": "warm-interior-dark-wood-tray",
      "duration_seconds": 4,
      "trim_duration_seconds": 3.9,
      "keyframe_ids": ["6a", "6b"],
      "product_reference": "codex_clone_refs/fish_glass/pic_1.jpg",
      "cues": [
        {"keyframe_id": "6a", "picture": 1, "scene_id": "warm-interior-dark-wood-tray", "start_seconds": 0.0, "end_seconds": 1.633, "transition": "start", "action": "One right hand closes around the completed clear drink and lifts it vertically out of frame."},
        {"keyframe_id": "6b", "picture": 2, "scene_id": "warm-interior-dark-wood-tray", "start_seconds": 1.633, "end_seconds": 3.9, "transition": "hard_cut", "action": "Cut to the second empty matching glass on the same dark wooden tray; drop the held ice cube into it, then add two more cubes with the same tongs."}
      ]
    },
    {
      "id": "H07",
      "scene_id": "warm-kitchen-white-marble",
      "duration_seconds": 2,
      "trim_duration_seconds": 1.9,
      "keyframe_ids": ["6c"],
      "product_reference": "codex_clone_refs/fish_glass/pic_1.jpg",
      "cues": [{"keyframe_id": "6c", "picture": 1, "scene_id": "warm-kitchen-white-marble", "start_seconds": 0.0, "end_seconds": 1.9, "transition": "start", "action": "On the white marble surface, begin a smooth milk stream from the white ceramic pitcher over the three cubes; only one hand and a short forearm remain visible."}]
    },
    {
      "id": "H08",
      "scene_id": "warm-interior-striped-linen-runner",
      "duration_seconds": 3,
      "trim_duration_seconds": 2.733,
      "keyframe_ids": ["7a"],
      "product_reference": "codex_clone_refs/fish_glass/pic_1.jpg",
      "cues": [{"keyframe_id": "7a", "picture": 1, "scene_id": "warm-interior-striped-linen-runner", "start_seconds": 0.0, "end_seconds": 2.733, "transition": "start", "action": "Keep the glass on the striped linen runner and pour dark coffee into the iced milk, preserving the natural brown-white colour bloom without stirring."}]
    },
    {
      "id": "H09",
      "scene_id": "warm-interior-dark-wood-tray",
      "duration_seconds": 4,
      "trim_duration_seconds": 3.067,
      "keyframe_ids": ["7b", "8"],
      "product_reference": "codex_clone_refs/fish_glass/pic_1.jpg",
      "cues": [
        {"keyframe_id": "7b", "picture": 1, "scene_id": "warm-interior-dark-wood-tray", "start_seconds": 0.0, "end_seconds": 1.633, "transition": "start", "action": "Begin on both completed drinks side by side on the dark wooden tray and settle into a restrained pull-back while both glasses remain still."},
        {"keyframe_id": "8", "picture": 2, "scene_id": "warm-interior-dark-wood-tray", "start_seconds": 1.633, "end_seconds": 3.067, "transition": "hard_cut", "action": "Cut to the tighter paired-drink view on the same dark wooden tray and make one small controlled circular stir in the clear citrus drink while the milk coffee remains still."}
      ]
    },
    {
      "id": "H10",
      "scene_id": "warm-interior-dark-wood-tray",
      "duration_seconds": 4,
      "trim_duration_seconds": 3.466,
      "keyframe_ids": ["9a", "9b"],
      "product_reference": "codex_clone_refs/fish_glass/pic_1.jpg",
      "cues": [
        {"keyframe_id": "9a", "picture": 1, "scene_id": "warm-interior-dark-wood-tray", "start_seconds": 0.0, "end_seconds": 1.6, "transition": "start", "action": "Grip the clear drink on the dark wooden tray and lift it straight toward the lens until it becomes a soft foreground wipe."},
        {"keyframe_id": "9b", "picture": 2, "scene_id": "warm-interior-dark-wood-tray", "start_seconds": 1.6, "end_seconds": 3.466, "transition": "foreground_wipe_cut", "action": "Use the glass wipe as the cut into the final clean two-drink hero on the dark wooden tray; make a subtle settling pull-back and finish on a calm locked hold."}
      ]
    }
  ]
}
